<?xml version="1.0" encoding="UTF-8"?>
<jboss-identity xmlns="urn:picketlink:idm:config:v1_0_0_ga"
                xmlns:xsi="http://www.w3.org/2001/XMLSchema-instance"
                xsi:schemaLocation="urn:picketlink:idm:config:v1_0_0_ga identity-config.xsd">
    <realms>
        <realm>
            <id>realm://JBossIdentityExample/SampleRealm</id>
            <repository-id-ref>Sample Repository</repository-id-ref>
            <identity-type-mappings>
                <user-mapping>USER</user-mapping>
            </identity-type-mappings>
        </realm>
    </realms>
    <repositories>
        <repository>
            <id>Sample Repository</id>
            <class>org.picketlink.idm.impl.repository.WrapperIdentityStoreRepository</class>
            <external-config/>
            <default-identity-store-id>Sample DB Store</default-identity-store-id>
            <default-attribute-store-id>Sample DB Store</default-attribute-store-id>
        </repository>
    </repositories>
    <stores>
        <attribute-stores/>
        <identity-stores>
            <identity-store>
                <id>Sample DB Store</id>
                <class>org.picketlink.idm.impl.store.hibernate.HibernateIdentityStoreImpl</class>
                <external-config/>
                <supported-relationship-types>
                    <relationship-type>JBOSS_IDENTITY_MEMBERSHIP</relationship-type>
                    <relationship-type>JBOSS_IDENTITY_ROLE</relationship-type>
                </supported-relationship-types>
                <supported-identity-object-types>
                    <identity-object-type>
                        <name>USER</name>
                        <relationships>
                        </relationships>
                        <credentials>
                            <credential-type>PASSWORD</credential-type>
                        </credentials>
                        <attributes>
                            <attribute>
                                <name>picture</name>
                                <mapping>user.picture</mapping>
                                <type>binary</type>
                                <isRequired>false</isRequired>
                                <isMultivalued>false</isMultivalued>
                                <isReadOnly>false</isReadOnly>
                            </attribute>
                        </attributes>
                        <options/>
                    </identity-object-type>
                    <identity-object-type>
                        <name>ORGANIZATION</name>
                        <relationships>
                            <relationship>
                                <relationship-type-ref>JBOSS_IDENTITY_ROLE</relationship-type-ref>
                                <identity-object-type-ref>USER</identity-object-type-ref>
                            </relationship>
                            <relationship>
                                <relationship-type-ref>JBOSS_IDENTITY_MEMBERSHIP</relationship-type-ref>
                                <identity-object-type-ref>USER</identity-object-type-ref>
                            </relationship>
                            <relationship>
                                <relationship-type-ref>JBOSS_IDENTITY_MEMBERSHIP</relationship-type-ref>
                                <identity-object-type-ref>GROUP</identity-object-type-ref>
                            </relationship>
                        </relationships>
                        <credentials/>
                        <attributes/>
                        <options/>
                    </identity-object-type>
                    <identity-object-type>
                        <name>GROUP</name>
                        <relationships>
                            <relationship>
                                <relationship-type-ref>JBOSS_IDENTITY_ROLE</relationship-type-ref>
                                <identity-object-type-ref>USER</identity-object-type-ref>
                            </relationship>
                            <relationship>
                                <relationship-type-ref>JBOSS_IDENTITY_MEMBERSHIP</relationship-type-ref>
                                <identity-object-type-ref>USER</identity-object-type-ref>
                            </relationship>
                            <relationship>
                                <relationship-type-ref>JBOSS_IDENTITY_MEMBERSHIP</relationship-type-ref>
                                <identity-object-type-ref>GROUP</identity-object-type-ref>
                            </relationship>
                        </relationships>
                        <credentials/>
                        <attributes/>
                        <options/>
                    </identity-object-type>
                </supported-identity-object-types>
                <options>
                    <option>
                        <name>hibernateSessionFactoryRegistryName</name>
                        <value>registeredSessionFactory1</value>
                    </option>
                    <option>
                        <name>populateRelationshipTypes</name>
                        <value>true</value>
                    </option>
                    <option>
                        <name>populateIdentityObjectTypes</name>
                        <value>true</value>
                    </option>
                    <option>
                        <name>allowNotDefinedAttributes</name>
                        <value>true</value>
                    </option>
                    <option>
                        <name>isRealmAware</name>
                        <value>true</value>
                    </option>
                </options>
            </identity-store>
        </identity-stores>
    </stores>
</jboss-identity>